<?xml version="1.0" encoding="UTF-8" standalone="no"?><physiopractice xmlns:lib="http://www.avans.nl/ivh5/worked-example" xmlns:xsi="http://www.w3.org/2001/XMLSchema-instance" xsi:schemaLocation="http://www.avans.nl/ivh5/worked-example physiopractice.xsd">
	<name>Zorg4me</name>
	<address>Straat 123A</address>
	<postal>1234AB</postal>
	<city>Breda</city>
	<phone>0698765432</phone>
	<email>info@zorg4u.nl</email>
	<kvk>12312312</kvk>
	<iban>NL91ABNA0417164300</iban>
	<bic>ABNANL2A</bic>
	<bank>ABN Amro</bank>
</physiopractice>